mysql> use onebilldemodb
Database changed
mysql>  select max(exp) from employee where exp<(select max(exp) from employee where exp<(select max(exp) from employee));
+----------+
| max(exp) |
+----------+
|        7 |
+----------+
1 row in set (0.00 sec)

mysql> select * from orders LEFT OUTER JOIN customer on orders.cid=customer.cid;
+-----+--------+------+------+---------------+-------------+
| oid | amount | cid  | cid  | customer_name | designation |
+-----+--------+------+------+---------------+-------------+
| 601 |  10000 |    1 |    1 | Rohan         | Engineer    |
| 603 |  15000 |    2 |    2 | Raj           | Tester      |
| 602 |  20000 |    3 |    3 | Rohit         | Analyst     |
+-----+--------+------+------+---------------+-------------+
3 rows in set (0.00 sec)

mysql> select * from orders RIGHT OUTER JOIN customer on orders.cid=customer.cid;
+------+--------+------+-----+---------------+-------------+
| oid  | amount | cid  | cid | customer_name | designation |
+------+--------+------+-----+---------------+-------------+
|  601 |  10000 |    1 |   1 | Rohan         | Engineer    |
|  602 |  20000 |    3 |   3 | Rohit         | Analyst     |
|  603 |  15000 |    2 |   2 | Raj           | Tester      |
| NULL |   NULL | NULL |   4 | Raja          | Devoloper   |
+------+--------+------+-----+---------------+-------------+
4 rows in set (0.00 sec)

mysql>  select * from orders RIGHT OUTER JOIN customer on orders.cid=customer.cid union select * from orders LEFT OUTER JOIN customer on orders.cid=customer.cid; 
+------+--------+------+------+---------------+-------------+
| oid  | amount | cid  | cid  | customer_name | designation |
+------+--------+------+------+---------------+-------------+
|  601 |  10000 |    1 |    1 | Rohan         | Engineer    |
|  602 |  20000 |    3 |    3 | Rohit         | Analyst     |
|  603 |  15000 |    2 |    2 | Raj           | Tester      |
| NULL |   NULL | NULL |    4 | Raja          | Devoloper   |
+------+--------+------+------+---------------+-------------+
4 rows in set (0.00 sec)

mysql> create trigger t1                                                                                                                                                                                               -> before insert                                                                                                                                                                                                   -> on sales                                                                                                                                                                                                        -> for each row                                                                                                                                                                                                    -> set new.total=new.qtysold*new.price                                                                                                                                                                             -> $$   
    -> ^C
mysql> show triggers;
+---------+--------+-------+-------------------------------------+--------+------------------------+----------------------------------------------------------------+----------------+----------------------+----------------------+--------------------+
| Trigger | Event  | Table | Statement                           | Timing | Created                | sql_mode                                                       | Definer        | character_set_client | collation_connection | Database Collation |
+---------+--------+-------+-------------------------------------+--------+------------------------+----------------------------------------------------------------+----------------+----------------------+----------------------+--------------------+
| t1      | INSERT | sales | set new.total=new.qtysold*new.price | BEFORE | 2021-05-31 20:30:32.73 | STRICT_TRANS_TABLES,NO_AUTO_CREATE_USER,NO_ENGINE_SUBSTITUTION | root@localhost | utf8                 | utf8_general_ci      | utf8_general_ci    |
+---------+--------+-------+-------------------------------------+--------+------------------------+----------------------------------------------------------------+----------------+----------------------+----------------------+--------------------+
1 row in set (0.00 sec)

mysql> drop trigger t1;
Query OK, 0 rows affected (0.01 sec)

mysql> delimiter $$
mysql> create trigger t1
    -> before insert
    -> on sales
    -> for each row
    -> set new.total=new.qtysold*new.price
    -> $$
Query OK, 0 rows affected (0.02 sec)


mysql> use onebilldemodb;
Database changed
mysql> delimiter $$
mysql> create trigger t2
    -> after insert
    -> on sales
    -> for each row
    -> begin
    -> update item set qoh=qoh-new.qtysold where itemid=new.itemid;
    -> end $$
Query OK, 0 rows affected (0.04 sec)

mysql> select * from sales;
    -> $$
+-----+--------+---------+-------+-------+
| sid | itemid | qtysold | price | total |
+-----+--------+---------+-------+-------+
| 101 |      2 |      10 |   100 |  1000 |
| 102 |      1 |      10 |    10 |   100 |
+-----+--------+---------+-------+-------+
2 rows in set (0.02 sec)

mysql> delimiter ;
mysql> select * from item;
+--------+---------+------+-------+-----------+
| itemid | iemdesc | qoh  | price | category  |
+--------+---------+------+-------+-----------+
|      1 | Perfume |  190 |   100 | cosmetics |
|      2 | Marie   |  200 |    10 | snacks    |
+--------+---------+------+-------+-----------+
2 rows in set (0.00 sec)

mysql> insert into sales values(103,2,100,10,0);
Query OK, 1 row affected (0.01 sec)

mysql> select * from item;
+--------+---------+------+-------+-----------+
| itemid | iemdesc | qoh  | price | category  |
+--------+---------+------+-------+-----------+
|      1 | Perfume |  190 |   100 | cosmetics |
|      2 | Marie   |  100 |    10 | snacks    |
+--------+---------+------+-------+-----------+
2 rows in set (0.00 sec)

mysql> select * from sales;
+-----+--------+---------+-------+-------+
| sid | itemid | qtysold | price | total |
+-----+--------+---------+-------+-------+
| 101 |      2 |      10 |   100 |  1000 |
| 102 |      1 |      10 |    10 |   100 |
| 103 |      2 |     100 |    10 |  1000 |
+-----+--------+---------+-------+-------+
3 rows in set (0.00 sec)



mysql> drop procedure printemployee;
    -> $$
Query OK, 0 rows affected (0.02 sec)

mysql> show procedures;
    -> $$
ERROR 1064 (42000): You have an error in your SQL syntax; check the manual that corresponds to your MySQL server version for the right syntax to use near 'procedures' at line 1
mysql> delimiter ;
mysql> delimiter $$
mysql> create procedure printemployee(id)
    -> begin
    -> select * from employee where empid=id; 
    -> end $$
ERROR 1064 (42000): You have an error in your SQL syntax; check the manual that corresponds to your MySQL server version for the right syntax to use near ')
begin
select * from employee where empid=id; 
end' at line 1
mysql> create procedure printemployee(IN id int)
    -> begin
    -> select * from employee where empid=id; 
    -> end $$
Query OK, 0 rows affected (0.00 sec)

mysql> delimiter ;
mysql>  call printemployee(2);
+-------+------+------------+--------+------------+------------+--------+------+------+-----------------+
| empid | name | email      | mobile | doj        | dob        | gender | exp  | dept | designation     |
+-------+------+------------+--------+------------+------------+--------+------+------+-----------------+
|     2 | Arun | AR@gma.com | 593512 | 2017-01-08 | 2000-02-16 | m      |    2 | B    | System engineer |
+-------+------+------------+--------+------------+------------+--------+------+------+-----------------+
1 row in set (0.00 sec)

Query OK, 0 rows affected (0.02 sec)

mysql> create procedure getMaxExp(OUT MaxExp int ,In id int) 
    -> begin
    ->  select max(exp) as MaxExp from employee;
ERROR 1064 (42000): You have an error in your SQL syntax; check the manual that corresponds to your MySQL server version for the right syntax to use near '' at line 3
mysql> delimiter $$
mysql> create procedure getMaxExp(OUT MaxExp int ,In id int) 
    -> begin
    ->  select max(exp) as MaxExp from employee;
    -> end $$
Query OK, 0 rows affected (0.00 sec)

mysql> call getMaxExp(@marks,1);
    -> $$
+--------+
| MaxExp |
+--------+
|     14 |
+--------+
1 row in set (0.00 sec)

Query OK, 0 rows affected (0.01 sec)

mysql> create procedure Counter(INOUT counter int,IN inc int)
    -> begin
    -> set counter=counter+inc;
    -> end $$
Query OK, 0 rows affected (0.00 sec)

mysql> delimiter ;
mysql> set @counter=1
    -> ;
Query OK, 0 rows affected (0.00 sec)

mysql> call Counter(@counter,1);
Query OK, 0 rows affected (0.00 sec)

mysql> select @counter;
+----------+
| @counter |
+----------+
|        2 |
+----------+
1 row in set (0.00 sec)

mysql> alter table office add column status varchar(20);
Query OK, 0 rows affected (0.15 sec)
Records: 0  Duplicates: 0  Warnings: 0

mysql> desc office;
+------------+-------------+------+-----+---------+-------+
| Field      | Type        | Null | Key | Default | Extra |
+------------+-------------+------+-----+---------+-------+
| officeCode | int(11)     | YES  |     | NULL    |       |
| city       | varchar(30) | YES  |     | NULL    |       |
| phone      | int(11)     | YES  |     | NULL    |       |
| address1   | varchar(30) | YES  |     | NULL    |       |
| address2   | varchar(30) | YES  |     | NULL    |       |
| state      | varchar(10) | YES  |     | NULL    |       |
| country    | varchar(20) | YES  |     | NULL    |       |
| postalCode | int(11)     | YES  |     | NULL    |       |
| status     | varchar(20) | YES  |     | NULL    |       |
+------------+-------------+------+-----+---------+-------+
9 rows in set (0.00 sec)

mysql> select * from office;
+------------+---------------+--------+----------+----------+-------+---------+------------+--------+
| officeCode | city          | phone  | address1 | address2 | state | country | postalCode | status |
+------------+---------------+--------+----------+----------+-------+---------+------------+--------+
|          1 | San Francisco | 423423 | add      | add      | CA    | USA     |      98040 | NULL   |
|          2 | San Diego     | 421413 | addr     | adrd     | CA    | USA     |      98041 | NULL   |
|          3 | Middle town   | 411413 | addr     | adrd     | NY    | UK      |       7463 | NULL   |
|          2 | San Diego     | 421413 | addr     | adrd     | CA    | USA     |      98041 | NULL   |
+------------+---------------+--------+----------+----------+-------+---------+------------+--------+
4 rows in set (0.00 sec)

mysql> update office set status="OK" where officeCode=1;
Query OK, 1 row affected (0.04 sec)
Rows matched: 1  Changed: 1  Warnings: 0

mysql> update office set status="OK" where officeCode=4;
Query OK, 0 rows affected (0.00 sec)
Rows matched: 0  Changed: 0  Warnings: 0

mysql> update office set status="FAIL" where officeCode=2;
Query OK, 2 rows affected (0.01 sec)
Rows matched: 2  Changed: 2  Warnings: 0

mysql> update office set status="UNKNOWN" where officeCode=3;
Query OK, 1 row affected (0.01 sec)
Rows matched: 1  Changed: 1  Warnings: 0

mysql> select * from office;
+------------+---------------+--------+----------+----------+-------+---------+------------+---------+
| officeCode | city          | phone  | address1 | address2 | state | country | postalCode | status  |
+------------+---------------+--------+----------+----------+-------+---------+------------+---------+
|          1 | San Francisco | 423423 | add      | add      | CA    | USA     |      98040 | OK      |
|          2 | San Diego     | 421413 | addr     | adrd     | CA    | USA     |      98041 | FAIL    |
|          3 | Middle town   | 411413 | addr     | adrd     | NY    | UK      |       7463 | UNKNOWN |
|          2 | San Diego     | 421413 | addr     | adrd     | CA    | USA     |      98041 | FAIL    |
+------------+---------------+--------+----------+----------+-------+---------+------------+---------+
4 rows in set (0.00 sec)

mysql> delimiter ##
mysql> create procedure getStatus(IN code int)
    -> begin
    -> ^C
mysql> create procedure getStatus(IN code int)
    -> 
    -> ^C
mysql> create procedure getStatus(IN code int)
    -> begin
    -> select status from office where officeCode=code;
    -> end ##
Query OK, 0 rows affected (0.00 sec)

mysql> getStatus(1);
    -> ##
ERROR 1064 (42000): You have an error in your SQL syntax; check the manual that corresponds to your MySQL server version for the right syntax to use near 'getStatus(1)' at line 1
mysql> delimiter ;
mysql> getStatus(1);
ERROR 1064 (42000): You have an error in your SQL syntax; check the manual that corresponds to your MySQL server version for the right syntax to use near 'getStatus(1)' at line 1
mysql> call getStatus(1);
+--------+
| status |
+--------+
| OK     |
+--------+
1 row in set (0.00 sec)

Query OK, 0 rows affected (0.01 sec)

mysql> call getStatus(2);
+--------+
| status |
+--------+
| FAIL   |
| FAIL   |
+--------+
2 rows in set (0.00 sec)

Query OK, 0 rows affected (0.01 sec)

mysql> call getStatus(4);
Empty set (0.00 sec)

Query OK, 0 rows affected (0.00 sec)

mysql> call getStatus(3);
+---------+
| status  |
+---------+
| UNKNOWN |
+---------+
1 row in set (0.00 sec)

Query OK, 0 rows affected (0.01 sec)

mysql> create procedure getSomething(OUT Data varchar(20),IN code int)
    -> begin
    -> select concat(city,state) as Data from office where officeCode=code;
ERROR 1064 (42000): You have an error in your SQL syntax; check the manual that corresponds to your MySQL server version for the right syntax to use near '' at line 3
mysql> delimiter ##
mysql> create procedure getSomething(OUT Data varchar(20),IN code int)
    -> begin
    -> select concat(city,state) as Data from office where officeCode=code;
    -> end ##
Query OK, 0 rows affected (0.00 sec)

mysql> delimiter ;
mysql> call getSomething(@Data,1);
+-----------------+
| Data            |
+-----------------+
| San FranciscoCA |
+-----------------+
1 row in set (0.00 sec)

Query OK, 0 rows affected (0.01 sec)

